{"boundary":{"clock":"monotonic","end_event":"artifact_written","instrumentation":"none","start_event":"producer_exec"},"build":{"binaries":[{"name":"dsl_warm_matrix","sha256":"sha256:98c38d2874a4317f7c5ba01af112f75d60697852da42f5040fd6018d1cb14668"}],"flags":["--locked"],"lockfile_digest":"sha256:3d1efe6dd279d8640c7b2de0155ce05eaebfcb924e10e4d1fe2e6cff91352a81","profile":"bench","target_triple":"aarch64-apple-darwin","toolchain":"rustc 1.92.0"},"case_id":null,"command":{"argv":["just","rust-bench-dsl-warm"],"cwd":".","exit_code":0,"status":"completed","timeout_seconds":1800,"wall_ms":12345},"created_utc":"2026-09-26T12:00:00Z","digest":"sha256:1fb7da42d50d891bb0ced8ee5c7a2e264e86edd0849037cee690c9dedcedd14e","family":"dsl-warm","host":{"arch":"aarch64","cpu_count":10,"hostname_hash":"sha256:2b6bb722637e1f8456222357d04d27199341492df36d7541a5bf2127e602f0ac","identity_digest":"sha256:5fb06d4e4bf76a75293902ca53e2c8f77bde1cdfc2cac1627d5788e555e6e8a8","lease":{"mode":"shared","observed_samples":1},"os":"macos","policy":"local-diagnostic"},"inputs":[{"availability":"present","digest":"sha256:2f9f6af898d96d6e60ccaf591b43f276462220d2f008820ff90102c7efcb527f","id":"workspace-fixture","reason":null}],"output_digest":"sha256:87726e1ecd1386bec79ad0acfb6722a1a5a363bd041384d33ee946a6edf226af","payload":{"drops":0,"errors":0,"kind":"latency","rows":[{"case_id":"lexical.keyword.native","early_stop_reason":null,"error_count":0,"metric":"p50","p50":0.42,"p95":0.55,"p99":0.61,"samples":200,"timeout_count":0,"unit":"ms"}],"timeouts":0},"profile":"dsl-authority","protocol":"BenchmarkEvidenceV1","protocol_version":1,"raw":[{"bytes":39,"path":"raw/warm-matrix.json","sha256":"sha256:7e9008651469b92ea273f1d66161aa050e6faf0f42848db7ce0b125bed294ef8"}],"run_id":"run-20260926T120000Z-a1b2c3d4","source":{"closure_digest":"sha256:7795033b88857c198db36c1171925cf9073f027c38b90334768c1de50c1e040f","closure_profile":"benchmark-control-plane","dirty":false,"dirty_paths_digest":null,"revision":"0123456789abcdef0123456789abcdef01234567"},"verdict":{"metrics":[{"denominator":null,"name":"p50_ms","numerator":null,"unit":"ms","value":0.42}],"reason":null,"scope":"diagnostic","status":"pass"}}
